"Goals at risk? Machine learning at support of early assessment","P. Avesani; A. Perini; A. Siena; A. Susi","Fondazione Bruno Kessler, Trento-Povo, I-38123 Italy; Fondazione Bruno Kessler, Trento-Povo, I-38123 Italy; Fondazione Bruno Kessler, Trento-Povo, I-38123 Italy; Fondazione Bruno Kessler, Trento-Povo, I-38123 Italy","2015 IEEE 23rd International Requirements Engineering Conference (RE)","","2015","","","252","255","A relevant activity in the requirements engineering process consists in the identification, assessment and management of potential risks, which can prevent the system-to-be from meeting stakeholder needs. However, risk analysis techniques are often time- and resource- consuming activities, which may introduce in the requirements engineering process a significant overhead. To overcome this problem, we aim at supporting risk management activity in a semi-automated way, merging the capability to exploit existing risk-related information potentially present in a given organisation, with an automated ranking of the goals with respect to the level of risk the decision-maker estimates for them. In particular, this paper proposes an approach to address the general problem of risk decision-making, which combines knowledge about risks assessment techniques and Machine Learning to enable an active intervention of human evaluators in the decision process, learning from their feedback and integrating it with the organisational knowledge. The long term objective is that of improving the capacity of an organisation to be aware and to manage risks, by introducing new techniques in the field of risk management that are able to interactively and continuously extract useful knowledge from the organisation domain and from the decision-maker expertise.",";","","10.1109/RE.2015.7320432","","https://ieeexplore.ieee.org.ezproxy.cdigital.uv.mx:8443/stamp/stamp.jsp?arnumber=7320432","","Risk management;Decision making;Requirements engineering;Approximation methods;Open source software;Yttrium","decision making;formal specification;knowledge acquisition;learning (artificial intelligence)","machine learning;requirements engineering process;potential risk identification;potential risk assessment;potential risk management;risk analysis techniques;risk-related information;automated ranking;decision-maker;risks assessment techniques;human evaluators;decision process;organisational knowledge;knowledge extraction","","1","","9","","","","","IEEE","IEEE Conferences"
"Early failure prediction in feature request management systems","C. Fitzgerald; E. Letier; A. Finkelstein","Dept. of Computer Science, University College London, London, United Kingdom; Dept. of Computer Science, University College London, London, United Kingdom; Dept. of Computer Science, University College London, London, United Kingdom","2011 IEEE 19th International Requirements Engineering Conference","","2011","","","229","238","Online feature request management systems are popular tools for gathering stakeholder requirements during system evolution. Deciding which feature requests require attention and how much upfront analysis to perform on them is an important problem in this context: too little upfront analysis may result in inadequate functionalities being developed, costly changes, and wasted development effort; too much upfront analysis is a waste of time and resources. Early predictions about which feature requests are most likely to fail due to insufficient or inadequate upfront analysis could facilitate such decisions. Our objective is to study whether it is possible to make such predictions automatically from the characteristics of the online discussions on feature requests. The paper presents a tool-implemented framework that automatically constructs failure prediction models using machine-learning classification algorithms and compares the performance of the different techniques for the Firefox and Netbeans projects. The comparison relies on a cost-benefit model for assessing the value of additional upfront analysis. In this model, the value of additional upfront analysis depends on its probability of success in preventing failures and on the relative cost of the failures it prevents compared to its own cost. We show that for reasonable estimations of these two parameters automated prediction models provide more value than a set of baselines for some failure types and projects. This suggests that automated failure prediction during online requirements elicitation may be a promising approach for guiding requirements engineering efforts in online settings.",";;","","10.1109/RE.2011.6051658","","https://ieeexplore.ieee.org.ezproxy.cdigital.uv.mx:8443/stamp/stamp.jsp?arnumber=6051658","Early failure prediction;Cost-benefit of requirements engineering;Feature requests management systems;Global software development;Open source","Predictive models;Fires;Analytical models;Educational institutions;Feature extraction;Mathematical model","formal verification;learning (artificial intelligence);pattern classification","early failure prediction;online feature request management systems;machine-learning classification algorithms;cost-benefit model;requirements engineering","","8","","23","","","","","IEEE","IEEE Conferences"
"Which Feature is Unusable? Detecting Usability and User Experience Issues from User Reviews","E. Bakiu; E. Guzman","Tech. Univ. Munchen, Munich, Germany; Univ. of Zurich, Zurich, Switzerland","2017 IEEE 25th International Requirements Engineering Conference Workshops (REW)","","2017","","","182","187","Usability and user experience (UUX) strongly affect software quality and success. User reviews allow software users to report UUX issues. However, this information can be difficult to access due to the varying quality of the reviews, its large numbers and unstructured nature. In this work we propose an approach to automatically detect the UUX strengths and issues of software features according to user reviews. We use a collocation algorithm for extracting the features, lexical sentiment analysis for uncovering users' satisfaction about a particular feature and machine learning for detecting the specific UUX issues affecting the software application. Additionally, we present two visualizations of the results. An initial evaluation of the approach against human judgement obtained mixed results.","","","10.1109/REW.2017.76","","https://ieeexplore.ieee.org.ezproxy.cdigital.uv.mx:8443/stamp/stamp.jsp?arnumber=8054850","user feedback;software evolution;text mining;user experience;usability","Feature extraction;Usability;Data mining;Visualization;Software algorithms;Sentiment analysis","feature extraction;human factors;learning (artificial intelligence);sentiment analysis;software quality","software users;software features;user reviews;software application;user experience issues;software quality;Usability and user experience;UUX;collocation algorithm;feature extraction;lexical sentiment analysis;machine learning","","1","","37","","","","","IEEE","IEEE Conferences"
"Open innovation in software requirements engineering: A mapping study","H. Yin; D. Pfahl","Institute of Computer Science, University of Tartu, J. Liivi 2, Tartu 50409, Estonia; Institute of Computer Science, University of Tartu, J. Liivi 2, Tartu 50409, Estonia","2017 8th IEEE International Conference on Software Engineering and Service Science (ICSESS)","","2017","","","5","10","Background: Since 2003, when the concept of open innovation (OI) was introduced, OI has been applied in many industrial fields. Previous research indicates that the use of OI in computer science is less diverse than in other fields. Especially, the role of OI in software requirements engineering (RE) seems to be little explored. Goals: This study aimed to summarize the body of knowledge about the use of OI in the field of RE. More specifically, we analyzed what uses of OI in the context of RE have been reported and how OI has contributed to individual steps of the RE process. Method: We conduct a mapping study on the literature provided in four scientific databases (ISI Web of Science, IEEE Xplore, ACM Digital Library, and Science Direct). Results: We identified 20 relevant papers. We found: 1) 20 primary studies from the period 2003-2016 report on results about applying OI in RE. 2) Half of the studies report on the application of OI on RE as a whole. 3) Only one paper each is related to requirement prioritization and validation. 4) None of the primary studies presents a proprietary tool support for OI in RE. Only one study presents a method for automatic requirements extraction in OSS projects which can be implemented using standard machine learning tools. Conclusions: Acknowledging the lack of published research on the use of OI strategies in specific RE activities, i.e., prioritization and validation, as well as the lack of reported tool support, we see new opportunities for research on automated and thus non-intrusive and low-cost methods for applying OI strategies in RE.","","","10.1109/ICSESS.2017.8342852","","https://ieeexplore.ieee.org.ezproxy.cdigital.uv.mx:8443/stamp/stamp.jsp?arnumber=8342852","Open Innovation;Requirement Engineering;Literature Review","Technological innovation;Software;Databases;Requirements engineering;Stakeholders;Data mining;Computer science","innovation management;public domain software;software engineering","open innovation;software requirements engineering;mapping study;OI strategies;OSS projects","","","","37","","","","","IEEE","IEEE Conferences"
"Hidden in plain sight: Automatically identifying security requirements from natural language artifacts","M. Riaz; J. King; J. Slankas; L. Williams","Department of Computer Science, North Carolina State University, Raleigh, USA; Department of Computer Science, North Carolina State University, Raleigh, USA; Department of Computer Science, North Carolina State University, Raleigh, USA; Department of Computer Science, North Carolina State University, Raleigh, USA","2014 IEEE 22nd International Requirements Engineering Conference (RE)","","2014","","","183","192","Natural language artifacts, such as requirements specifications, often explicitly state the security requirements for software systems. However, these artifacts may also imply additional security requirements that developers may overlook but should consider to strengthen the overall security of the system. The goal of this research is to aid requirements engineers in producing a more comprehensive and classified set of security requirements by (1) automatically identifying security-relevant sentences in natural language requirements artifacts, and (2) providing context-specific security requirements templates to help translate the security-relevant sentences into functional security requirements. Using machine learning techniques, we have developed a tool-assisted process that takes as input a set of natural language artifacts. Our process automatically identifies security-relevant sentences in the artifacts and classifies them according to the security objectives, either explicitly stated or implied by the sentences. We classified 10,963 sentences in six different documents from healthcare domain and extracted corresponding security objectives. Our manual analysis showed that 46% of the sentences were security-relevant. Of these, 28% explicitly mention security while 72% of the sentences are functional requirements with security implications. Using our tool, we correctly predict and classify 82% of the security objectives for all the sentences (precision). We identify 79% of all security objectives implied by the sentences within the documents (recall). Based on our analysis, we develop context-specific templates that can be instantiated into a set of functional security requirements by filling in key information from security-relevant sentences.",";","","10.1109/RE.2014.6912260","","https://ieeexplore.ieee.org.ezproxy.cdigital.uv.mx:8443/stamp/stamp.jsp?arnumber=6912260","Security;requirements;objectives;templates;access control;auditing;text classification;constraints;natural language parsing","Security;Natural languages;Object recognition;Software systems;Availability;Medical services;Text categorization","formal specification;learning (artificial intelligence);natural language processing;security of data","natural language artifacts;requirements specifications;software systems;requirements engineer;security-relevant sentences;natural language requirements artifacts;context-specific security requirements templates;functional security requirements;machine learning techniques;tool-assisted process;security objectives;healthcare domain;functional requirements;context-specific templates","","16","","40","","","","","IEEE","IEEE Conferences"
"SIMISS: A Model-Based Searching Strategy for Inventory Management Systems","Y. T. Demey; M. Wolff","Department of Requirements Engineering and Solution Design (Search and Knowledge Management IM2.8.3.3), European Patent Office, EE Rijswijk, The Netherlands; European Space Agency, ESA/ESTEC/TEC-SWM, Noordwijk, AZ, The Netherlands","IEEE Internet of Things Journal","","2017","4","1","172","182","Inventory management is critical in human space flight operations. Currently, we use the inventory management system (IMS) in keeping track of items on the International Space Station (ISS). One challenge is to discover lost or wrongly placed items when IMS fails to discover them due to human factors. In this paper, we will illustrate a model-based searching strategy called semantic inventory management for ISS (SIMISS), with which possible locations of lost items will be calculated based on contextual features in three dimensions: (1) spatial; (2) temporal; and (3) human. It contains ontologies, databases, machine learning algorithms, and ubiquitous client applications. We have implemented and tested SIMISS with the sample data from IMS, operation data files and onboard short term plan experiments have been carried out in a set of simulation scenarios.",";","","10.1109/JIOT.2016.2638023","ESA under the Research Fellowship Program (RFP); ","https://ieeexplore.ieee.org.ezproxy.cdigital.uv.mx:8443/stamp/stamp.jsp?arnumber=7778999","Big data analysis;fact-based modeling (FBM);Internet of Things (IoT);radio frequency identification (RFID)","Ontologies;Inventory management;Context;Machine learning algorithms;Internet of Things;Semantics;Analytical models","aerospace computing;database management systems;inventory management;learning (artificial intelligence);ontologies (artificial intelligence);ubiquitous computing","model-based searching strategy;human space flight operations;IMS;International Space Station;human factors;semantic inventory management-for-ISS;contextual features;spatial dimension;temporal dimension;human dimension;ontologies;database mangement;machine learning algorithms;ubiquitous client applications;SIMISS;operation data files","","","","51","","","","","IEEE","IEEE Journals"
"Probing for Requirements Knowledge to Stimulate Architectural Thinking","P. R. Anish; B. Balasubramaniam; A. Sainani; J. Cleland-Huang; M. Daneva; R. J. Wieringa; S. Ghaisas","TATA Res. Dev. & Design Centre, TATA Consultancy Services Ltd., Pune, India; TATA Res. Dev. & Design Centre, TATA Consultancy Services Ltd., Pune, India; TATA Res. Dev. & Design Centre, TATA Consultancy Services Ltd., Pune, India; Syst. & Requirements Eng. Center, DePaul Univ., Chicago, IL, USA; Univ. of Twente, Enschede, Netherlands; Univ. of Twente, Enschede, Netherlands; TATA Res. Dev. & Design Centre, TATA Consultancy Services Ltd., Pune, India","2016 IEEE/ACM 38th International Conference on Software Engineering (ICSE)","","2016","","","843","854","Software requirements specifications (SRSs) often lack the detail needed to make informed architectural decisions. Architects therefore either make assumptions, which can lead to incorrect decisions, or conduct additional stakeholder interviews, resulting in potential project delays. We previously observed that software architects ask Probing Questions (PQs) to gather information crucial to architectural decision-making. Our goal is to equip Business Analysts with appropriate PQs so that they can ask these questions themselves. We report a new study with over 40 experienced architects to identify reusable PQs for five areas of functionality and organize them into structured flows. These PQflows can be used by Business Analysts to elicit and specify architecturally relevant information. Additionally, we leverage machine learning techniques to determine when a PQ-flow is appropriate for use in a project, and to annotate individual PQs with relevant information extracted from the existing SRS. We trained and evaluated our approach on over 8,000 individual requirements from 114 requirements specifications and also conducted a pilot study to validate its usefulness.","","","10.1145/2884781.2884801","","https://ieeexplore.ieee.org.ezproxy.cdigital.uv.mx:8443/stamp/stamp.jsp?arnumber=7886961","Architecturally significant requirements;automated requirement classification;functional requirements;requirements knowledge;Probing Questions (PQs);PQ-flows","Interviews;Barium;Software;Stakeholders;Batch production systems;Requirements engineering","formal specification;learning (artificial intelligence);software architecture","requirements knowledge;architecturally significant requirements;probing questions;PQ-flow;machine learning techniques;software requirements specifications;SRS","","2","","52","","","","","IEEE","IEEE Conferences"
"Let’s Hear it from RETTA: A Requirements Elicitation Tool for TrAffic Management Systems","M. Noaeen; Z. S. H. Abad; B. H. Far","Dept. of Electr. & Comput. Eng., Univ. of Calgary, Calgary, AB, Canada; Dept. of Comput. Sci., Univ. of Calgary, Calgary, AB, Canada; Dept. of Electr. & Comput. Eng., Univ. of Calgary, Calgary, AB, Canada","2017 IEEE 25th International Requirements Engineering Conference (RE)","","2017","","","450","451","The area of Traffic Management (TM) is characterized by uncertainty, complexity, and imprecision. The complexity of software systems in the TM domain which contributes to a more challenging Requirements Engineering (RE) job mainly stems from the diversity of stakeholders and complexity of requirements elicitation in this domain. This work brings an interactive solution for exploring functional and non-functional requirements of software-reliant systems in the area of traffic management. We prototyped the RETTA tool which leverages the wisdom of the crowd and combines it with machine learning approaches such as Natural Language Processing and Naïve Bayes to help with the requirements elicitation and classification task in the TM domain. This bridges the gap among stakeholders from both areas of software development and transportation engineering. The RETTA prototype is mainly designed for requirements engineers and software developers in the area of TM and can be used on Android-based devices.","","","10.1109/RE.2017.78","","https://ieeexplore.ieee.org.ezproxy.cdigital.uv.mx:8443/stamp/stamp.jsp?arnumber=8049156","Requirements Engineering;Transportation Management;Tool Development;Traffic Signal Timing","Tools;Transportation;Complexity theory;Data analysis;Prototypes;Computational modeling;Requirements engineering","Android (operating system);Bayes methods;formal specification;graphical user interfaces;learning (artificial intelligence);natural language processing;pattern classification;systems analysis;traffic engineering computing","TM domain;software development;transportation engineering;software systems;nonfunctional requirements;software-reliant systems;RETTA tool;machine learning approaches;Natural Language Processing;requirements engineering;requirements elicitation tool-for-traffic management systems;functional requirements;naïve Bayes method;Android-based devices","","4","","7","","","","","IEEE","IEEE Conferences"
"Automatic Multi-class Non-Functional Software Requirements Classification Using Neural Networks","C. Baker; L. Deng; S. Chakraborty; J. Dehlinger","Towson University; Towson University; Towson University; Towson University","2019 IEEE 43rd Annual Computer Software and Applications Conference (COMPSAC)","","2019","2","","610","615","Advances in machine learning (ML) algorithms, graphics processing units, and readily available ML libraries have enabled the application of ML to open software engineering challenges. Yet, the use of ML to enable decision-making during the software engineering lifecycle is not well understood as there are various ML models requiring parameter tuning. In this paper, we leverage ML techniques to develop an effective approach to classify software requirements. Specifically, we investigate the design and application of two types of neural network models, an artificial neural network (ANN) and a convolutional neural network (CNN), to classify non-functional requirements (NFRs) into the following five categories: maintainability, operability, performance, security and usability. We illustrate and experimentally evaluate this work through two widely used datasets consisting of nearly 1,000 NFRs. Our results indicate that our CNN model can effectively classify NFRs by achieving precision ranging between 82% and 94%, recall ranging between 76% and 97% with an F-score ranging between 82% and 92%.","","","10.1109/COMPSAC.2019.10275","","https://ieeexplore.ieee.org.ezproxy.cdigital.uv.mx:8443/stamp/stamp.jsp?arnumber=8754214","non-functional requirements;requirements engineering;machine learning","Software;Conferences","convolutional neural nets;formal specification;learning (artificial intelligence);software quality","CNN model;automatic multiclass nonfunctional software requirements classification;neural networks;machine learning;software engineering lifecycle;ML models;neural network models;artificial neural network;convolutional neural network;nonfunctional requirements;NFR","","","","24","","","","","IEEE","IEEE Conferences"
"A Systematic Approach of Dataset Definition for a Supervised Machine Learning Using NFR Framework","M. Marinho; D. Arruda; F. Wanderley; A. Lins","Centro de Cienc. e Tecnol., Univ. Catolica de Pernambuco, Recife, Brazil; Centro de Cienc. e Tecnol., Univ. Catolica de Pernambuco, Recife, Brazil; Centro de Cienc. e Tecnol., Univ. Catolica de Pernambuco, Recife, Brazil; Centro de Cienc. e Tecnol., Univ. Catolica de Pernambuco, Recife, Brazil","2018 11th International Conference on the Quality of Information and Communications Technology (QUATIC)","","2018","","","110","118","Non-functional requirements describe important constraints upon the software development and should therefore be considered and specified as early as possible during the system analysis. Effective elicitation of requirements is arguably among the most important of the resulting recommended RE practices. Recent research has shown that artificial intelligence techniques such as Machine Learning and Text Mining perform the automatic extraction and classification of quality attributes from text documents with relevant results. This paper aims to define a systematic process of dataset generation through NFR Framework catalogues improving the NFR's classification process using Machine Learning techniques. A well-known dataset (Promise) was used to evaluate the precision of our approach reaching interesting results. Regarding to security and performance we obtained a precision and recall ranging between ~85% and ~98%. And we achievement a F1 above ~79% when classified the security, performance and usability together.","","","10.1109/QUATIC.2018.00024","","https://ieeexplore.ieee.org.ezproxy.cdigital.uv.mx:8443/stamp/stamp.jsp?arnumber=8590177","non-fucntional requirements;NFR framework;artificial inteligence;machine learning;SIG","Machine learning;Systematics;Security;Requirements engineering;Usability","data mining;formal specification;formal verification;learning (artificial intelligence);pattern classification;systems analysis;text analysis","systematic approach;dataset definition;nonfunctional requirements;software development;system analysis;artificial intelligence techniques;automatic extraction;text documents;systematic process;dataset generation;NFR's classification process;text mining;supervised machine learning techniques","","","","44","","","","","IEEE","IEEE Conferences"
