"Automated Validation of Requirement Reviews: A Machine Learning Approach","M. Singh","Dept. of Comput. Sci. & Eng., North Dakota State Univ., Fargo, ND, USA","2018 IEEE 26th International Requirements Engineering Conference (RE)","","2018","","","460","465","Software development is fault-prone especially during the fuzzy phases (requirements and design). Software inspections are commonly used in industry to detect and fix problems in requirements and design artifacts thereby mitigating the fault propagation to later phases where same faults are harder to find and fix. The output of an inspection process is natural language (NL) reviews that report the location and description of faults in software requirements specification document (SRS). The artifact author must manually read through the reviews and differentiate between true-faults and false-positives before fixing the faults. The time spent in making effective post-inspection decisions (number of true faults and deciding whether to re-inspect) could be spent in doing actual development work. The goal of this research is to automate the validation of inspection reviews, finding common patterns that describe high-quality requirements, identify fault prone requirements pre-inspection, and interrelated requirements to assist fixation of reported faults post-inspection. To accomplish these goals, this research employs various classification approaches, NL processing with semantic analysis and mining solutions from graph theory to requirement reviews and NL requirements. Initial results w.r.t. validation of inspection reviews have shown that our proposed approaches were able to successfully categorize useful and non-useful reviews.",";","","10.1109/RE.2018.00062","","https://ieeexplore.ieee.org.ezproxy.cdigital.uv.mx:8443/stamp/stamp.jsp?arnumber=8491169","requirement inspections;classification;semantic analysis;topic modeling;high quality requirements;interrelated requirements;part of speech tags","Inspection;Software;Semantics;Fault diagnosis;Analytical models;Data mining;Natural languages","data mining;formal specification;graph theory;inspection;learning (artificial intelligence);natural language processing;program diagnostics;software development management;software fault tolerance;software quality","requirement reviews;software development;fuzzy phases;software inspections;design artifacts;fault propagation;inspection process;software requirements specification document;actual development work;inspection reviews;high-quality requirements;fault prone requirements pre-inspection;interrelated requirements;reported faults post-inspection;NL processing;NL requirements;post-inspection decisions","","","","23","","","","","IEEE","IEEE Conferences"
"SReYantra: Automated Software Requirement Inter-Dependencies Elicitation, Analysis and Learning","G. Deshpande","University of Calgary","2019 IEEE/ACM 41st International Conference on Software Engineering: Companion Proceedings (ICSE-Companion)","","2019","","","186","187","Requirements elicitation is a cognitively difficult task. Rich semantics in natural language based requirements impose challenges in elicitation, analysis and maintenance of requirement inter-dependencies. The challenges intensify further when dependency types and strengths are considered. Ignoring inter-dependencies can adversely impact the design, development and testing of software products. This PhD research proposal addresses three main challenges. First, Natural Language Processing (NLP) is studied to automatically extract dependencies from textual documents. Further verb classifiers are utilized to automate elicitation and analysis of different types of dependencies (e.g: requires, coupling etc). Second, representation and maintenance of changing requirement dependencies from designing graph theoretic algorithms will be explored. Third, the process of providing recommendations of dependencies will be studied. The results are aimed at assisting project managers to evaluate the impact of inter-dependencies and make effective decisions in software development life cycle.",";","","10.1109/ICSE-Companion.2019.00076","","https://ieeexplore.ieee.org.ezproxy.cdigital.uv.mx:8443/stamp/stamp.jsp?arnumber=8802756","Requirements Engineering, Requirements Interdependency Management, NLP, Machine Learning","","formal specification;graph theory;learning (artificial intelligence);natural language processing;software engineering","automated software requirement inter-dependencies elicitation;requirements elicitation;natural language based requirements;maintenance;software products;PhD research proposal;requirement dependencies;software development life cycle;natural language processing;SReYantra;NLP;dependencies extraction;graph theoretic algorithms","","","","9","","","","","IEEE","IEEE Conferences"
"Weka meets TraceLab: Toward convenient classification: Machine learning for requirements engineering problems: A position paper","J. H. Hayes; W. Li; M. Rahimi","Computer Science Department University of Kentucky Lexington, Kentucky, USA; Computer Science Department University of Kentucky Lexington, Kentucky, USA; School of Computing DePaul University Chicago, Illinois, USA","2014 IEEE 1st International Workshop on Artificial Intelligence for Requirements Engineering (AIRE)","","2014","","","9","12","Requirements engineering encompasses many difficult, overarching problems inherent to its subareas of process, elicitation, specification, analysis, and validation. Requirements engineering researchers seek innovative, effective means of addressing these problems. One powerful tool that can be added to the researcher toolkit is that of machine learning. Some researchers have been experimenting with their own implementations of machine learning algorithms or with those available as part of the Weka machine learning software suite. There are some shortcomings to using “one off” solutions. It is the position of the authors that many problems exist in requirements engineering that can be supported by Weka's machine learning algorithms, specifically by classification trees. Further, the authors posit that adoption will be boosted if machine learning is easy to use and is integrated into requirements research tools, such as TraceLab. Toward that end, an initial concept validation of a component in TraceLab is presented that applies the Weka classification trees. The component is demonstrated on two different requirements engineering problems. Finally, insights gained on using the TraceLab Weka component on these two problems are offered.","","","10.1109/AIRE.2014.6894850","","https://ieeexplore.ieee.org.ezproxy.cdigital.uv.mx:8443/stamp/stamp.jsp?arnumber=6894850","Artificial intelligence;machine learning;requirements engineering;classification;decision trees;TraceLab;Weka","Classification tree analysis;Classification algorithms;Machine learning algorithms;Educational institutions;Software;Supervised learning","decision trees;formal specification;learning (artificial intelligence);pattern classification","TraceLab Weka component;Weka classification trees;requirements research tools;one off solutions;requirements engineering problems;Weka machine learning software suite","","4","","12","","","","","IEEE","IEEE Conferences"
"Software Feature Request Detection in Issue Tracking Systems","T. Merten; M. Falis; P. Hübner; T. Quirchmayr; S. Bürsner; B. Paech","NA; NA; NA; NA; NA; NA","2016 IEEE 24th International Requirements Engineering Conference (RE)","","2016","","","166","175","Communication about requirements is often handled in issue tracking systems, especially in a distributed setting. As issue tracking systems also contain bug reports or programming tasks, the software feature requests of the users are often difficult to identify. This paper investigates natural language processing and machine learning features to detect software feature requests in natural language data of issue tracking systems. It compares traditional linguistic machine learning features, such as ""bag of words"", with more advanced features, such as subject-action-object, and evaluates combinations of machine learning features derived from the natural language and features taken from the issue tracking system meta-data. Our investigation shows that some combinations of machine learning features derived from natural language and the issue tracking system meta-data outperform traditional approaches. We show that issues or data fields (e.g. descriptions or comments), which contain software feature requests, can be identified reasonably well, but hardly the exact sentence. Finally, we show that the choice of machine learning algorithms should depend on the goal, e.g. maximization of the detection rate or balance between detection rate and precision. In addition, the paper contributes a double coded gold standard and an open-source implementation to further pursue this topic.","","","10.1109/RE.2016.8","","https://ieeexplore.ieee.org.ezproxy.cdigital.uv.mx:8443/stamp/stamp.jsp?arnumber=7765522","Software Feature Request Detection;Mining Software Repositories;Machine Learning;Natural Language Processing","Software;Computer bugs;Natural languages;Feature extraction;Machine learning algorithms;Prediction algorithms;Training data","learning (artificial intelligence);natural language processing;program debugging;systems analysis","software feature request detection;issue tracking systems;requirements engineering;bug reports;programming tasks;natural language processing;machine learning;natural language data;bag of words;subject-action-object;meta-data;data fields","","13","","28","","","","","IEEE","IEEE Conferences"
"RE Data Challenge: Requirements Identification with Word2Vec and TensorFlow","A. Dekhtyar; V. Fong","NA; NA","2017 IEEE 25th International Requirements Engineering Conference (RE)","","2017","","","484","489","Since their introduction over a year ago, Google's TensorFlow package for learning with multilayer neural networks and their Word2Vec representation of words have both gained a high degree of notoriety. This paper considers the application of TensorFlow-guided learning and Word2Vec-based representations to the problems of classification in requirements documents. In this paper, we compare three categories of machine learning techniques for requirements identification for the SecReq and NFR datasets. The first category is the baseline method used in prior work: Naïve Bayes over word count and TF-IDF representations of requirements. The remaining two categories of techniques are the training of TensorFlow's convolutional neural networks on random and pre-trained Word2Vec embeddings of the words found in the requirements. This paper reports on the experiments we conducted and the accuracy results we achieved.","","","10.1109/RE.2017.26","","https://ieeexplore.ieee.org.ezproxy.cdigital.uv.mx:8443/stamp/stamp.jsp?arnumber=8049170","machine learning;convolutional neural networks;requirements identification;TensorFlow;Word2Vec","Convolution;Google;Vocabulary;Feature extraction;Neural networks;Training","Bayes methods;formal specification;learning (artificial intelligence);natural language processing;neural nets;pattern classification;systems analysis;text analysis","multilayer neural networks;Word2Vec representation;requirements documents;requirements identification;word count;Word2Vec embeddings;Google TensorFlow package;TensorFlow convolutional neural networks;TensorFlow-guided learning;machine learning techniques;SecReq dataset;NFR dataset;naive Bayes;TF-IDF representation","","3","","13","","","","","IEEE","IEEE Conferences"
"Measuring Requirement Quality to Predict Testability","J. H. Hayes; W. Li; T. Yu; X. Han; M. Hays; C. Woodson","Department of Computer Science University of Kentucky USA; Department of Computer Science University of Kentucky USA; Department of Computer Science University of Kentucky USA; Department of Computer Science University of Kentucky USA; Department of Computer Science University of Kentucky USA; Department of Computer Science University of Kentucky USA","2015 IEEE Second International Workshop on Artificial Intelligence for Requirements Engineering (AIRE)","","2015","","","1","8","Software bugs contribute to the cost of ownership for consumers in a software-driven society and can potentially lead to devastating failures. Software testing, including functional testing and structural testing, remains a common method for uncovering faults and assessing dependability of software systems. To enhance testing effectiveness, the developed artifacts (requirements, code) must be designed to be testable. Prior work has developed many approaches to address the testability of code when applied to structural testing, but to date no work has considered approaches for assessing and predicting testability of requirements to aid functional testing. In this work, we address requirement testability from the perspective of requirement understandability and quality using a machine learning and statistical analysis approach. We first use requirement measures to empirically investigate the relevant relationship between each measure and requirement testability. We then assess relevant requirement measures for predicting requirement testability. We examined two datasets, each consisting of requirement and code artifacts. We found that several measures assist in delineating between the testable and non-testable requirements, and found anecdotal evidence that a learned model of testability can be used to guide evaluation of requirements for other (non-trained) systems.","","","10.1109/AIRE.2015.7337622","","https://ieeexplore.ieee.org.ezproxy.cdigital.uv.mx:8443/stamp/stamp.jsp?arnumber=7337622","requirement testability;code testability;machine learning;supervised classification learning;statistical analysis;correlation analysis;subjective assessment;human analyst","Testing;Correlation;Software;Indexes;Browsers;Logistics;Statistical analysis","formal verification;learning (artificial intelligence);program debugging;program testing;software quality;statistical analysis","requirement quality measurement;testability prediction;software bugs;ownership cost;software-driven society;software testing;functional testing;structural testing;software system fault;software system dependability assessment;code testability;requirement testability;requirement understandability;machine learning;statistical analysis approach","","2","","23","","","","","IEEE","IEEE Conferences"
